Name,Description,Latitude,Longitude,InfoURL,ImageURL
UCSB,A great university located along the California coast!,34.416929,-119.845991,"https://en.wikipedia.org/wiki/University_of_California, _Santa_Barbara",https://www.history.ucsb.edu/wp-content/uploads/LagoonFall2014-banner.jpg
Golden Gate Bridge,"A beautiful bridge in the Bay Area, where I grew up!",37.8185,-122.4738,https://en.wikipedia.org/wiki/Golden_Gate_Bridge,https://upload.wikimedia.org/wikipedia/commons/thumb/a/ac/Golden_Gate_Bridge_Yang_Ming_Line.jpg/1024px-Golden_Gate_Bridge_Yang_Ming_Line.jpg
"Fort Augustus, Scotland",A peaceful village in northern Scotland I got to visit once when I was a kid,57.1432,-4.6807,https://en.wikipedia.org/wiki/Fort_Augustus,https://upload.wikimedia.org/wikipedia/commons/thumb/4/4b/Caledonian_Canal%2C_Fort_Augustus_to_Loch_Ness.jpg/800px-Caledonian_Canal%2C_Fort_Augustus_to_Loch_Ness.jpg
Santa Monica Pier,A vibrant beach in Santa Monica with a ferris wheel and other carnival rides and games,34.01009,-118.496948,https://en.wikipedia.org/wiki/Santa_Monica_Pier,https://upload.wikimedia.org/wikipedia/commons/thumb/0/08/Santa_Monica_Pier_in_Los_Angeles.jpg/1024px-Santa_Monica_Pier_in_Los_Angeles.jpg
"Mission Peak in Fremont, CA",A hiking spot in my hometown of Fremont that I used to climb regularly,37.5124365,-121.8805126,https://en.wikipedia.org/wiki/Mission_Peak,https://upload.wikimedia.org/wikipedia/commons/thumb/4/42/South_San_Francisco_Bay_viewed_from_Mission_Peak_in_Fremont%2C_California.JPG/1024px-South_San_Francisco_Bay_viewed_from_Mission_Peak_in_Fremont%2C_California.JPG
"Downtown Victoria, BC, Canada","The gorgeous capital of BC, and the city where my mom grew up",48.407326,-123.329773,"https://en.wikipedia.org/wiki/Victoria,_British_Columbia",https://upload.wikimedia.org/wikipedia/commons/thumb/d/de/Victoria-bc-parliament.jpg/800px-Victoria-bc-parliament.jpg